headline,url
Climate crisis  IPCC issues ‘bleakest warning yet’ on impacts of climate breakdown ,https://www.theguardian.com/environment/2022/feb/28/ipcc-issues-bleakest-warning-yet-impacts-climate-breakdown
"Analysis This climate crisis report asks: what is at stake? In short, everything",https://www.theguardian.com/environment/2022/feb/28/what-at-stake-climate-crisis-report-everything
"Analysis This climate crisis report asks: what is at stake? In short, everything",https://www.theguardian.com/environment/2022/feb/28/what-at-stake-climate-crisis-report-everything
IPCC issues ‘bleakest warning yet’ on impacts of climate breakdown,https://www.theguardian.com/environment/2022/feb/28/ipcc-issues-bleakest-warning-yet-impacts-climate-breakdown
Environment  US supreme court signals it may restrict EPA’s ability to fight climate crisis ,https://www.theguardian.com/environment/2022/feb/28/supreme-court-epa-biden-climate-crisis
US supreme court signals it may restrict EPA’s ability to fight climate crisis,https://www.theguardian.com/environment/2022/feb/28/supreme-court-epa-biden-climate-crisis
"Coronavirus  Pfizer vaccine significantly less effective in children ages five to 11, study shows ",https://www.theguardian.com/society/2022/feb/28/pfizer-vaccine-less-effective-children-ages-five-to-11-data
US New Covid vaccinations drop as cases and hospitalizations decline,https://www.theguardian.com/us-news/2022/feb/28/us-new-covid-vaccinations-decline-cases-hospitalizations-drop
US New Covid vaccinations drop as cases and hospitalizations decline,https://www.theguardian.com/us-news/2022/feb/28/us-new-covid-vaccinations-decline-cases-hospitalizations-drop
"Pfizer vaccine significantly less effective in children ages five to 11, study shows",https://www.theguardian.com/society/2022/feb/28/pfizer-vaccine-less-effective-children-ages-five-to-11-data
"Shaking ceilings, raunchy songs  Complaints of New Yorkers’ noisy sex are rising ",https://www.theguardian.com/us-news/2022/feb/28/new-yorkers-complaints-noisy-sex
Complaints of New Yorkers’ noisy sex are rising,https://www.theguardian.com/us-news/2022/feb/28/new-yorkers-complaints-noisy-sex
Donald Trump  Ex-president appeals ruling requiring him to testify in New York investigation ,https://www.theguardian.com/us-news/2022/feb/28/donald-trump-appeals-testify-new-york-investigation
Ex-president appeals ruling requiring him to testify in New York investigation,https://www.theguardian.com/us-news/2022/feb/28/donald-trump-appeals-testify-new-york-investigation
Mexico  Bodies missing after drug cartel massacre caught on video ,https://www.theguardian.com/world/2022/feb/28/mexico-men-disappeared-drug-cartel
Bodies missing after drug cartel massacre caught on video,https://www.theguardian.com/world/2022/feb/28/mexico-men-disappeared-drug-cartel
Gaza  Israel under pressure to conclude flawed case against aid worker ,https://www.theguardian.com/world/2022/feb/28/israel-under-pressure-trial-aid-worker-mohammed-el-halabi
Israel under pressure to conclude flawed case against aid worker,https://www.theguardian.com/world/2022/feb/28/israel-under-pressure-trial-aid-worker-mohammed-el-halabi
‘Before they were our brothers. Now I want revenge’  Tigray conflict engulfs neighbouring state ,https://www.theguardian.com/global-development/2022/feb/28/before-they-were-our-brothers-now-i-want-revenge-tigray-conflict-engulfs-neighbouring-state
Tigray conflict engulfs neighbouring state,https://www.theguardian.com/global-development/2022/feb/28/before-they-were-our-brothers-now-i-want-revenge-tigray-conflict-engulfs-neighbouring-state
Facebook  Company takes down Ukraine disinformation network and bans Russian-backed media ,https://www.theguardian.com/technology/2022/feb/28/facebook-takes-down-disinformation-network-targeting-ukraine-meta-instagram
Company takes down Ukraine disinformation network and bans Russian-backed media,https://www.theguardian.com/technology/2022/feb/28/facebook-takes-down-disinformation-network-targeting-ukraine-meta-instagram
Markets  Defense and cybersecurity stocks climb amid Russia’s invasion of Ukraine ,https://www.theguardian.com/business/2022/feb/28/defense-cybersecurity-stocks-russia-ukraine-eu
Defense and cybersecurity stocks climb amid Russia’s invasion of Ukraine,https://www.theguardian.com/business/2022/feb/28/defense-cybersecurity-stocks-russia-ukraine-eu
