headline,url
Boris Johnson  UK PM wins no-confidence vote despite unexpectedly large rebellion ,https://www.theguardian.com/politics/2022/jun/06/boris-johnson-wins-no-confidence-vote-despite-unexpectedly-large-rebellion
Video The day in three minutes,https://www.theguardian.com/politics/video/2022/jun/06/the-day-in-three-minutes-boris-johnson-wins-no-confidence-vote-video
‘Long time coming’ How day of Tory infighting played out ,https://www.theguardian.com/politics/2022/jun/06/long-time-coming-how-day-of-tory-infighting-played-out
Johnson’s highs and lows From party hero to Partygate,https://www.theguardian.com/politics/gallery/2022/jun/06/boris-johnsons-highs-and-lows-from-party-hero-to-partygate-no-confidence-vote
Video The day in three minutes,https://www.theguardian.com/politics/video/2022/jun/06/the-day-in-three-minutes-boris-johnson-wins-no-confidence-vote-video
‘Long time coming’ How day of Tory infighting played out ,https://www.theguardian.com/politics/2022/jun/06/long-time-coming-how-day-of-tory-infighting-played-out
Johnson’s highs and lows From party hero to Partygate,https://www.theguardian.com/politics/gallery/2022/jun/06/boris-johnsons-highs-and-lows-from-party-hero-to-partygate-no-confidence-vote
UK PM wins no-confidence vote despite unexpectedly large rebellion,https://www.theguardian.com/politics/2022/jun/06/boris-johnson-wins-no-confidence-vote-despite-unexpectedly-large-rebellion
Proud Boys   Far-right group's leaders charged with seditious conspiracy in 6 January riot ,https://www.theguardian.com/us-news/2022/jun/06/proud-boys-leaders-charged-seditious-conspiracy-jan-6-riot
Far-right group's leaders charged with seditious conspiracy in 6 January riot,https://www.theguardian.com/us-news/2022/jun/06/proud-boys-leaders-charged-seditious-conspiracy-jan-6-riot
Twitter  Elon Musk threatens to scrap $44bn deal over ‘material breach’  ,https://www.theguardian.com/technology/2022/jun/06/elon-musk-threatens-to-scrap-twitter-deal-over-material-breach
Elon Musk threatens to scrap $44bn deal over ‘material breach’ ,https://www.theguardian.com/technology/2022/jun/06/elon-musk-threatens-to-scrap-twitter-deal-over-material-breach
‘Every second counts’  Wife of British journalist missing in Amazon urges action ,https://www.theguardian.com/world/2022/jun/07/british-journalist-dom-phillips-missing-amazon-brazil-wife-calls-for-urgency
Wife of British journalist missing in Amazon urges action,https://www.theguardian.com/world/2022/jun/07/british-journalist-dom-phillips-missing-amazon-brazil-wife-calls-for-urgency
Amy Coney Barrett  Legal claims shed light on founder of faith group tied to supreme court justice ,https://www.theguardian.com/world/2022/jun/06/people-of-praise-accused-child-abuse-amy-coney-barrett
Legal claims shed light on founder of faith group tied to supreme court justice,https://www.theguardian.com/world/2022/jun/06/people-of-praise-accused-child-abuse-amy-coney-barrett
Dominican Republic  Environment minister shot dead in his office ,https://www.theguardian.com/world/2022/jun/06/orlando-jorge-mera-dominican-republic-environment-minister
Environment minister shot dead in his office,https://www.theguardian.com/world/2022/jun/06/orlando-jorge-mera-dominican-republic-environment-minister
Israel  Coalition dealt a blow with loss of West Bank settler law vote ,https://www.theguardian.com/world/2022/jun/07/israeli-coalition-dealt-a-blow-with-loss-of-west-bank-settler-law-vote
Coalition dealt a blow with loss of West Bank settler law vote,https://www.theguardian.com/world/2022/jun/07/israeli-coalition-dealt-a-blow-with-loss-of-west-bank-settler-law-vote
"Kevin Spacey  Actor must face sexual abuse lawsuit in New York, judge says ",https://www.theguardian.com/culture/2022/jun/06/kevin-spacey-sexual-abuse-lawsuit-new-york
"Actor must face sexual abuse lawsuit in New York, judge says",https://www.theguardian.com/culture/2022/jun/06/kevin-spacey-sexual-abuse-lawsuit-new-york
Arizona  Man drowns in lake as officers watch: ‘I’m not jumping in after you’ ,https://www.theguardian.com/us-news/2022/jun/06/arizona-man-drowns-officers-watch
Man drowns in lake as officers watch: ‘I’m not jumping in after you’,https://www.theguardian.com/us-news/2022/jun/06/arizona-man-drowns-officers-watch
"Tiger King  Doc Antle, featured in hit series, charged with laundering $505,000 ",https://www.theguardian.com/tv-and-radio/2022/jun/06/tiger-king-doc-antle-accused-money-laundering
"Doc Antle, featured in hit series, charged with laundering $505,000",https://www.theguardian.com/tv-and-radio/2022/jun/06/tiger-king-doc-antle-accused-money-laundering
