headline,url
Democrats  Progressives retract Biden Ukraine letter after furious debate ,https://www.theguardian.com/us-news/2022/oct/25/democrats-joe-biden-ukraine-war-russia-letter
DeSantis Governor answers Crist attacks with bluster and silence,https://www.theguardian.com/us-news/2022/oct/25/ron-desantis-florida-governor-abortion-charlie-crist
DeSantis Governor answers Crist attacks with bluster and silence,https://www.theguardian.com/us-news/2022/oct/25/ron-desantis-florida-governor-abortion-charlie-crist
Progressives retract Biden Ukraine letter after furious debate,https://www.theguardian.com/us-news/2022/oct/25/democrats-joe-biden-ukraine-war-russia-letter
"Fossil fuels  Global health at mercy of fossil fuel addiction, warn scientists ",https://www.theguardian.com/environment/2022/oct/25/global-health-fossil-fuels-climate-oil-gas-food-energy-cost-of-living
"Global health at mercy of fossil fuel addiction, warn scientists",https://www.theguardian.com/environment/2022/oct/25/global-health-fossil-fuels-climate-oil-gas-food-energy-cost-of-living
Arizona  Deadliest summer for heat-related deaths in state's biggest county ,https://www.theguardian.com/us-news/2022/oct/25/arizona-heat-related-deaths-summer-maricopa-county
Deadliest summer for heat-related deaths in state's biggest county,https://www.theguardian.com/us-news/2022/oct/25/arizona-heat-related-deaths-summer-maricopa-county
Harvey Weinstein  Accuser testifies she wanted to ‘destroy’ herself after assault ,https://www.theguardian.com/us-news/2022/oct/25/harvey-weinstein-trial-witness
Accuser testifies she wanted to ‘destroy’ herself after assault,https://www.theguardian.com/us-news/2022/oct/25/harvey-weinstein-trial-witness
"US school shootings  St Louis shooter had more than 600 rounds of ammunition, police say ",https://www.theguardian.com/us-news/2022/oct/25/st-louis-school-shooting-latest-gunman-ammunition
"St Louis shooter had more than 600 rounds of ammunition, police say",https://www.theguardian.com/us-news/2022/oct/25/st-louis-school-shooting-latest-gunman-ammunition
When is a lynching a lynching?   Data reveals law agencies often don’t see racist motives ,https://www.theguardian.com/us-news/2022/oct/25/lynching-michael-williams-iowa-police-prosecutors
Data reveals law agencies often don’t see racist motives,https://www.theguardian.com/us-news/2022/oct/25/lynching-michael-williams-iowa-police-prosecutors
Voter fraud  Pamela Moses sues officials after conviction overturned ,https://www.theguardian.com/us-news/2022/oct/25/pamela-moses-sues-voter-fraud-conviction-overturned-tennessee
Pamela Moses sues officials after conviction overturned,https://www.theguardian.com/us-news/2022/oct/25/pamela-moses-sues-voter-fraud-conviction-overturned-tennessee
Alphabet  Google parent company's third quarter results fall as giant struggles to compete with TikTok ,https://www.theguardian.com/technology/2022/oct/25/alphabet-google-third-quarter-revenue-report
Google parent company's third quarter results fall as giant struggles to compete with TikTok,https://www.theguardian.com/technology/2022/oct/25/alphabet-google-third-quarter-revenue-report
Water  US lawmakers call for more measures to protect against toxic lead ,https://www.theguardian.com/us-news/2022/oct/25/toxic-lead-tap-water-senators-epa-action
US lawmakers call for more measures to protect against toxic lead,https://www.theguardian.com/us-news/2022/oct/25/toxic-lead-tap-water-senators-epa-action
Missouri  Police kill two dogs after Amazon driver dies in apparent animal attack ,https://www.theguardian.com/us-news/2022/oct/25/amazon-driver-dies-dogs-shot-apparent-animal-attack
Police kill two dogs after Amazon driver dies in apparent animal attack,https://www.theguardian.com/us-news/2022/oct/25/amazon-driver-dies-dogs-shot-apparent-animal-attack
