headline,url
Joe Biden  President pledges to use executive powers after Manchin refuses support for bills ,https://www.theguardian.com/us-news/2022/jul/15/joe-manchin-climate-funding-tax-hikes
Opinion It’s time for Democrats to fight back,https://www.theguardian.com/commentisfree/2022/jul/15/democrats-are-facing-asymmetrical-warfare-its-time-to-wake-up-and-fight-back
‘Modern-day villain’ Manchin condemned over climate move,https://www.theguardian.com/us-news/2022/jul/15/joe-manchin-condemned-us-climate-action
Climate crisis Democratic voters say Biden could be doing a lot more,https://www.theguardian.com/environment/2022/jul/14/democratic-voters-biden-climate-crisis
Opinion It’s time for Democrats to fight back,https://www.theguardian.com/commentisfree/2022/jul/15/democrats-are-facing-asymmetrical-warfare-its-time-to-wake-up-and-fight-back
‘Modern-day villain’ Manchin condemned over climate move,https://www.theguardian.com/us-news/2022/jul/15/joe-manchin-condemned-us-climate-action
Climate crisis Democratic voters say Biden could be doing a lot more,https://www.theguardian.com/environment/2022/jul/14/democratic-voters-biden-climate-crisis
President pledges to use executive powers after Manchin refuses support for bills,https://www.theguardian.com/us-news/2022/jul/15/joe-manchin-climate-funding-tax-hikes
January 6  Panel examines whether erased Secret Service texts can be revived ,https://www.theguardian.com/us-news/2022/jul/15/january-6-hearings-secret-service-texts-erased
Panel examines whether erased Secret Service texts can be revived,https://www.theguardian.com/us-news/2022/jul/15/january-6-hearings-secret-service-texts-erased
Covid  The BA.5 variant is causing US cases to rise – should you be worried? All you need to know ,https://www.theguardian.com/world/2022/jul/15/covid-ba5-us-wave-what-you-need-to-know
The BA.5 variant is causing US cases to rise – should you be worried? All you need to know,https://www.theguardian.com/world/2022/jul/15/covid-ba5-us-wave-what-you-need-to-know
"Ivana Trump   First wife of ex-president died of blunt force injuries to her torso, medical examiner says ",https://www.theguardian.com/us-news/2022/jul/15/ivana-trump-donald-trump-wife-death-cause
"First wife of ex-president died of blunt force injuries to her torso, medical examiner says",https://www.theguardian.com/us-news/2022/jul/15/ivana-trump-donald-trump-wife-death-cause
Montana  At least five people dead after mass casualty pileup on Interstate 90 ,https://www.theguardian.com/us-news/2022/jul/16/at-least-five-people-dead-after-mass-casualty-pileup-on-interstate-90-in-montana
At least five people dead after mass casualty pileup on Interstate 90,https://www.theguardian.com/us-news/2022/jul/16/at-least-five-people-dead-after-mass-casualty-pileup-on-interstate-90-in-montana
California  Two suspects arrested in string of fatal robberies at 7-Eleven stores ,https://www.theguardian.com/us-news/2022/jul/15/two-arrested-robberies-california-7-eleven
Two suspects arrested in string of fatal robberies at 7-Eleven stores,https://www.theguardian.com/us-news/2022/jul/15/two-arrested-robberies-california-7-eleven
Indiana  Daughter of doctor who gave 10-year-old an abortion faced kidnapping threat ,https://www.theguardian.com/us-news/2022/jul/15/indiana-caitlin-bernard-doctor-abortion
Daughter of doctor who gave 10-year-old an abortion faced kidnapping threat,https://www.theguardian.com/us-news/2022/jul/15/indiana-caitlin-bernard-doctor-abortion
Texas  Man with methamphetamine in system was driving truck that killed college golfers ,https://www.theguardian.com/us-news/2022/jul/15/texas-truck-new-mexico-collision-college-golf-team
Man with methamphetamine in system was driving truck that killed college golfers,https://www.theguardian.com/us-news/2022/jul/15/texas-truck-new-mexico-collision-college-golf-team
Canada  Village entirely destroyed by wildfire in 2021 evacuated due to wildfire ,https://www.theguardian.com/world/2022/jul/15/lytton-british-columbia-wildfire-threatened
Village entirely destroyed by wildfire in 2021 evacuated due to wildfire,https://www.theguardian.com/world/2022/jul/15/lytton-british-columbia-wildfire-threatened
Abortion  House approves legislation to protect access across US  ,https://www.theguardian.com/us-news/2022/jul/15/house-abortion-vote-approved
House approves legislation to protect access across US ,https://www.theguardian.com/us-news/2022/jul/15/house-abortion-vote-approved
‘Narco of narcos’  Drug lord Rafael Caro Quintero arrested in Mexico ,https://www.theguardian.com/world/2022/jul/15/rafael-caro-quintero-arrested-mexico-drug-lord
Drug lord Rafael Caro Quintero arrested in Mexico,https://www.theguardian.com/world/2022/jul/15/rafael-caro-quintero-arrested-mexico-drug-lord
