headline,url
‘Hurtful and insulting’  Florida teachers react to the ‘don’t say gay’ bill ,https://www.theguardian.com/world/2022/apr/29/dont-say-gay-bill-florida-teachers-react
Florida teachers react to the ‘don’t say gay’ bill,https://www.theguardian.com/world/2022/apr/29/dont-say-gay-bill-florida-teachers-react
Ghislaine Maxwell  Judge denies bid to overturn sex trafficking conviction ,https://www.theguardian.com/us-news/2022/apr/29/ghislaine-maxwell-conviction-judge-denies
Judge denies bid to overturn sex trafficking conviction,https://www.theguardian.com/us-news/2022/apr/29/ghislaine-maxwell-conviction-judge-denies
January 6  Oath Keeper pleads guilty to seditious conspiracy over Capitol attack ,https://www.theguardian.com/us-news/2022/apr/29/us-capitol-attack-oath-keeper-guilty-seditious-conspiracy
Oath Keeper pleads guilty to seditious conspiracy over Capitol attack,https://www.theguardian.com/us-news/2022/apr/29/us-capitol-attack-oath-keeper-guilty-seditious-conspiracy
Twitter  Employees grill CEO Parag Agrawal over fears of post-Musk exodus ,https://www.theguardian.com/technology/2022/apr/29/twitter-employees-elon-musk-parag-agrawal
Employees grill CEO Parag Agrawal over fears of post-Musk exodus,https://www.theguardian.com/technology/2022/apr/29/twitter-employees-elon-musk-parag-agrawal
Islamic State  British-born terror cell member receives life sentence in US trial ,https://www.theguardian.com/world/2022/apr/29/islamic-state-alexanda-amon-kotey-life-sentence
British-born terror cell member receives life sentence in US trial,https://www.theguardian.com/world/2022/apr/29/islamic-state-alexanda-amon-kotey-life-sentence
California  Los Angeles mortuary owner left bodies to rot in ‘sad and shocking’ case ,https://www.theguardian.com/us-news/2022/apr/29/los-angeles-funeral-home-remains
Los Angeles mortuary owner left bodies to rot in ‘sad and shocking’ case,https://www.theguardian.com/us-news/2022/apr/29/los-angeles-funeral-home-remains
"New York  Judge denies Trump’s request to end contempt order and $10,000-a-day fine ",https://www.theguardian.com/us-news/2022/apr/29/donald-trump-judge-denies-request-end-contempt-order-keep-10000-a-day-fine
"Judge denies Trump’s request to end contempt order and $10,000-a-day fine",https://www.theguardian.com/us-news/2022/apr/29/donald-trump-judge-denies-request-end-contempt-order-keep-10000-a-day-fine
British Virgin Islands  UK to impose direct rule after inquiry finds rampant corruption ,https://www.theguardian.com/world/2022/apr/29/british-virgin-islands-direct-rule-andrew-fahie-drug-arrest
UK to impose direct rule after inquiry finds rampant corruption,https://www.theguardian.com/world/2022/apr/29/british-virgin-islands-direct-rule-andrew-fahie-drug-arrest
Afghanistan  Blast at Kabul mosque kills more than 50 worshippers ,https://www.theguardian.com/world/2022/apr/29/blast-kabul-mosque-worshippers-afghan-capital-ramadan
Blast at Kabul mosque kills more than 50 worshippers,https://www.theguardian.com/world/2022/apr/29/blast-kabul-mosque-worshippers-afghan-capital-ramadan
Donald Trump  Former president mocked for fearing protesters would throw ‘dangerous’ fruit at him ,https://www.theguardian.com/us-news/2022/apr/29/trump-dangerous-fruit-tomato-jokes
Former president mocked for fearing protesters would throw ‘dangerous’ fruit at him,https://www.theguardian.com/us-news/2022/apr/29/trump-dangerous-fruit-tomato-jokes
