headline,url
Donald Trump  Judge orders DoJ to prepare redacted search affidavit for possible release ,https://www.theguardian.com/us-news/2022/aug/18/trump-redacted-affidavit-release-mar-a-lago-fbi-search
Trump Organization Financial chief pleads guilty to tax fraud,https://www.theguardian.com/us-news/2022/aug/18/allen-weisselberg-trump-organization-pleads-guilty-tax-fraud
Liz Cheney Congresswoman releases call to Trump-backed opponent who said she didn’t concede,https://www.theguardian.com/us-news/2022/aug/18/liz-cheney-concession-call-trump-harriet-hageman
Trump Organization Financial chief pleads guilty to tax fraud,https://www.theguardian.com/us-news/2022/aug/18/allen-weisselberg-trump-organization-pleads-guilty-tax-fraud
Liz Cheney Congresswoman releases call to Trump-backed opponent who said she didn’t concede,https://www.theguardian.com/us-news/2022/aug/18/liz-cheney-concession-call-trump-harriet-hageman
Judge orders DoJ to prepare redacted search affidavit for possible release,https://www.theguardian.com/us-news/2022/aug/18/trump-redacted-affidavit-release-mar-a-lago-fbi-search
Jair Bolsonaro  Police call for Brazilian president to be charged for spreading Covid misinformation ,https://www.theguardian.com/world/2022/aug/18/jair-bolsonaro-covid-misinformation-charge-brazil-police
Police call for Brazilian president to be charged for spreading Covid misinformation,https://www.theguardian.com/world/2022/aug/18/jair-bolsonaro-covid-misinformation-charge-brazil-police
'Strippers are standing up'  Strip club dancers move to unionize with actors group ,https://www.theguardian.com/us-news/2022/aug/18/los-angeles-strip-club-dancers-unionize-actors-equity-association
Strip club dancers move to unionize with actors group,https://www.theguardian.com/us-news/2022/aug/18/los-angeles-strip-club-dancers-unionize-actors-equity-association
Los Angeles  Black parent sues after school project had students pick cotton ,https://www.theguardian.com/us-news/2022/aug/18/los-angeles-school-lawsuit-picking-cotton-slavery
Black parent sues after school project had students pick cotton,https://www.theguardian.com/us-news/2022/aug/18/los-angeles-school-lawsuit-picking-cotton-slavery
"Mexico  Students’ disappearance was a state-sponsored crime, truth panel says ",https://www.theguardian.com/world/2022/aug/18/mexico-43-students-missing-truth-commission-report
"Students’ disappearance was a state-sponsored crime, truth panel says",https://www.theguardian.com/world/2022/aug/18/mexico-43-students-missing-truth-commission-report
Apple  Security flaw ‘actively exploited’ by hackers to fully control devices ,https://www.theguardian.com/technology/2022/aug/18/apple-security-flaw-hack-iphone-ipad-macs
Security flaw ‘actively exploited’ by hackers to fully control devices,https://www.theguardian.com/technology/2022/aug/18/apple-security-flaw-hack-iphone-ipad-macs
Robert Kennedy Jr  Instagram and Facebook suspend anti-vaccine group ,https://www.theguardian.com/us-news/2022/aug/18/instagram-facebook-suspend-robert-kennedy-jr-anti-vax
Instagram and Facebook suspend anti-vaccine group,https://www.theguardian.com/us-news/2022/aug/18/instagram-facebook-suspend-robert-kennedy-jr-anti-vax
Florida  Officials arrest and charge 20 people with illegal voting ,https://www.theguardian.com/us-news/2022/aug/18/florida-arrests-illegal-voting-destanis
Officials arrest and charge 20 people with illegal voting,https://www.theguardian.com/us-news/2022/aug/18/florida-arrests-illegal-voting-destanis
Utah  School secretly investigated if winning female student athlete is transgender ,https://www.theguardian.com/us-news/2022/aug/18/utah-school-investigates-student-transgender
School secretly investigated if winning female student athlete is transgender,https://www.theguardian.com/us-news/2022/aug/18/utah-school-investigates-student-transgender
Rick Scott  Don’t apply for IRS jobs because Republicans will defund them ,https://www.theguardian.com/us-news/2022/aug/18/rick-scott-defund-irs-jobs-republicans-democrats
Don’t apply for IRS jobs because Republicans will defund them,https://www.theguardian.com/us-news/2022/aug/18/rick-scott-defund-irs-jobs-republicans-democrats
"Animals  Seal breaks into New Zealand home, traumatises cat and hangs out on couch ",https://www.theguardian.com/world/2022/aug/19/seal-breaks-into-new-zealand-home-traumatises-cat-and-hangs-out-on-couch
"Seal breaks into New Zealand home, traumatises cat and hangs out on couch",https://www.theguardian.com/world/2022/aug/19/seal-breaks-into-new-zealand-home-traumatises-cat-and-hangs-out-on-couch
