headline,url
CPAC  Viktor Orbán turns Texas conference into transatlantic far-right love-in ,https://www.theguardian.com/us-news/2022/aug/06/viktor-orban-cpac-far-right-us-trump
Viktor Orbán turns Texas conference into transatlantic far-right love-in,https://www.theguardian.com/us-news/2022/aug/06/viktor-orban-cpac-far-right-us-trump
"Ukraine  Strikes at nuclear plant ‘alarming’, says UN watchdog chief ",https://www.theguardian.com/world/2022/aug/06/strikes-at-ukrainian-nuclear-plant-alarming-says-un-watchdog-chief
"Strikes at nuclear plant ‘alarming’, says UN watchdog chief",https://www.theguardian.com/world/2022/aug/06/strikes-at-ukrainian-nuclear-plant-alarming-says-un-watchdog-chief
Live  China-Taiwan news: White House calls Chinese drills ‘provocative’ and ‘irresponsible’ ,https://www.theguardian.com/world/live/2022/aug/07/china-taiwan-news-white-house-calls-chinese-drills-provocative-and-irresponsible-live
Full report Taiwan says China making simulated attack,https://www.theguardian.com/world/2022/aug/06/taiwan-says-china-making-simulated-attack-main-island-military-drills
Analysis What the fallout from Pelosi’s visit means,https://www.theguardian.com/world/2022/aug/05/what-the-fallout-from-pelosis-visit-means-for-taiwan-and-china
Full report Taiwan says China making simulated attack,https://www.theguardian.com/world/2022/aug/06/taiwan-says-china-making-simulated-attack-main-island-military-drills
Analysis What the fallout from Pelosi’s visit means,https://www.theguardian.com/world/2022/aug/05/what-the-fallout-from-pelosis-visit-means-for-taiwan-and-china
China-Taiwan news: White House calls Chinese drills ‘provocative’ and ‘irresponsible’,https://www.theguardian.com/world/live/2022/aug/07/china-taiwan-news-white-house-calls-chinese-drills-provocative-and-irresponsible-live
Washington state  Republican who voted to impeach Trump projected to win primary ,https://www.theguardian.com/us-news/2022/aug/06/republican-dan-newshouse-trump-washington-primary
Republican who voted to impeach Trump projected to win primary,https://www.theguardian.com/us-news/2022/aug/06/republican-dan-newshouse-trump-washington-primary
Dom Phillips and Bruno Pereira  Five more people arrested in Brazil over murders  ,https://www.theguardian.com/world/2022/aug/06/five-more-people-arrested-in-brazil-over-murders-of-dom-phillips-and-bruno-pereira
Five more people arrested in Brazil over murders ,https://www.theguardian.com/world/2022/aug/06/five-more-people-arrested-in-brazil-over-murders-of-dom-phillips-and-bruno-pereira
Senate  Democrats given green light to vote on $430bn climate and tax bill ,https://www.theguardian.com/us-news/2022/aug/06/senate-democrats-climate-tax-health-spending-bill
Democrats given green light to vote on $430bn climate and tax bill,https://www.theguardian.com/us-news/2022/aug/06/senate-democrats-climate-tax-health-spending-bill
Anne Heche  Actor reportedly in critical condition after car crash in Los Angeles ,https://www.theguardian.com/us-news/2022/aug/06/actor-anne-heche-critical-condition-car-crash-ellen-degeneres-los-angeles
Actor reportedly in critical condition after car crash in Los Angeles,https://www.theguardian.com/us-news/2022/aug/06/actor-anne-heche-critical-condition-car-crash-ellen-degeneres-los-angeles
Covid  Biden tests negative but will isolate until second negative test ,https://www.theguardian.com/us-news/2022/aug/06/biden-covid-negative-test-white-house
Biden tests negative but will isolate until second negative test,https://www.theguardian.com/us-news/2022/aug/06/biden-covid-negative-test-white-house
Contraception  US jury finds in favor of pharmacist who denied woman morning-after pill ,https://www.theguardian.com/us-news/2022/aug/06/morning-after-pill-contraception-judge-minnesota
US jury finds in favor of pharmacist who denied woman morning-after pill,https://www.theguardian.com/us-news/2022/aug/06/morning-after-pill-contraception-judge-minnesota
Afghanistan  Bomb in Kabul shopping street injures at least 22 people ,https://www.theguardian.com/world/2022/aug/06/afghanistan-bomb-in-kabul-shopping-street-injures-at-least-22-people
Bomb in Kabul shopping street injures at least 22 people,https://www.theguardian.com/world/2022/aug/06/afghanistan-bomb-in-kabul-shopping-street-injures-at-least-22-people
Gaza Strip  Israel bombs enclave for second day in ‘pre-emptive operation’ ,https://www.theguardian.com/world/2022/aug/06/israel-bombs-gaza-strip-second-day-pre-emptive-operation-palestine
Israel bombs enclave for second day in ‘pre-emptive operation’,https://www.theguardian.com/world/2022/aug/06/israel-bombs-gaza-strip-second-day-pre-emptive-operation-palestine
